{
    "Version": 1,
    "Size": 0.5,
    "Viewport": {
        "MinX": -10.0,
        "MaxX": 10.0,
        "MinY": -10.0,
        "MaxY": 10.0
    },
    "Particles": [
        {
            "Id": 1
        },
        {
            "Id": 2
        }
    ],
    "Frames": [
        [
            {
                "X": 0.1,
                "Y": -0.3
            },
            {
                "X": 0.4,
                "Y": 0.6
            }
        ],
        [
            {
                "X": 0.2,
                "Y": -0.4
            },
            {
                "X": 0.5,
                "Y": 0.7
            }
        ],
        [
            {
                "X": 0.3,
                "Y": -0.5
            },
            {
                "X": 0.6,
                "Y": 0.8
            }
        ]
    ]
}